	set1_id	set1_country	set1_city	set2_id	set2_country	set2_city	set1_orgname_with_city	set2_orgname_with_city	set1_tokens	set2_tokens	similarity	id_match
490	60310829	United States	Durham	60323760	United States	Durham	SonoVol, Inc., Durham	Sonovol, Inc., Durham	sonovol|durham	sonovol|durham	1.0	False
491	60323760	United States	Durham	60310829	United States	Durham	Sonovol, Inc., Durham	SonoVol, Inc., Durham	sonovol|durham	sonovol|durham	1.0	False
492	60297102	United Kingdom	Edinburgh	60302631	United Kingdom	Edinburgh	Cirrus Logic International Semiconductor Ltd., Edinburgh	Cirrus Logic International Semiconductor Ltd, Edinburgh	cirrus|logic|international|semiconductor|edinburgh	cirrus|logic|international|semiconductor|edinburgh	1.0	False
493	60301685	United States	Philadelphia	60302826	United States	Philadelphia	Cira Discovery Sciences, Philadelphia	Cira Discovery Sciences, Inc., Philadelphia	cira|discovery|sciences|philadelphia	cira|discovery|sciences|philadelphia	1.0	False
494	60302631	United Kingdom	Edinburgh	60297102	United Kingdom	Edinburgh	Cirrus Logic International Semiconductor Ltd, Edinburgh	Cirrus Logic International Semiconductor Ltd., Edinburgh	cirrus|logic|international|semiconductor|edinburgh	cirrus|logic|international|semiconductor|edinburgh	1.0	False
495	60298597	Australia	Sydney	60298162	Australia	Sydney	Macquarie Research Ltd, Sydney	Macquarie Research Ltd., Sydney	macquarie|research|sydney	macquarie|research|sydney	1.0	False
496	60302758	United States	Boca Raton	60302143	United States	Boca Raton	ACK Ventures Holdings LLC, Boca Raton	ACK Ventures Holdings, LLC, Boca Raton	ack|ventures|holdings|llc|boca|raton	ack|ventures|holdings|llc|boca|raton	1.0	False
497	60311193	United States	San Francisco	60311303	United States	San Francisco	Siluria Technologies, Inc., San Francisco	Siluria Technologies, Inc, San Francisco	siluria|technologies|san|francisco	siluria|technologies|san|francisco	1.0	False
498	60311303	United States	San Francisco	60311193	United States	San Francisco	Siluria Technologies, Inc, San Francisco	Siluria Technologies, Inc., San Francisco	siluria|technologies|san|francisco	siluria|technologies|san|francisco	1.0	False
499	60302143	United States	Boca Raton	60302758	United States	Boca Raton	ACK Ventures Holdings, LLC, Boca Raton	ACK Ventures Holdings LLC, Boca Raton	ack|ventures|holdings|llc|boca|raton	ack|ventures|holdings|llc|boca|raton	1.0	False
500	60303054	United States	Redmond	60301855	United States	Redmond	NeoPath Inc., Redmond	NeoPath Inc, Redmond	neopath|redmond	neopath|redmond	1.0	False
501	60301855	United States	Redmond	60303054	United States	Redmond	NeoPath Inc, Redmond	NeoPath Inc., Redmond	neopath|redmond	neopath|redmond	1.0	False
502	60294854	Taiwan	Zhubei	60294407	Taiwan	Zhubei	Asclepiumm Taiwan Co., Ltd, Zhubei	Asclepiumm Taiwan Co., Ltd., Zhubei	asclepiumm|taiwan|zhubei	asclepiumm|taiwan|zhubei	1.0	False
503	60320591	United States	San Jose	60323901	United States	San Jose	NEO Semiconductor, Inc., San Jose	NEO Semiconductor, San Jose	neo|semiconductor|san|jose	neo|semiconductor|san|jose	1.0	False
504	60323901	United States	San Jose	60320591	United States	San Jose	NEO Semiconductor, San Jose	NEO Semiconductor, Inc., San Jose	neo|semiconductor|san|jose	neo|semiconductor|san|jose	1.0	False
505	60294407	Taiwan	Zhubei	60294854	Taiwan	Zhubei	Asclepiumm Taiwan Co., Ltd., Zhubei	Asclepiumm Taiwan Co., Ltd, Zhubei	asclepiumm|taiwan|zhubei	asclepiumm|taiwan|zhubei	1.0	False
506	60310463	China	Beijing	60019764	China	Beijing	China Mobile Communications Co., Ltd., Beijing	China Mobile Communications, Beijing	china|mobile|communications|beijing	china|mobile|communications|beijing	1.0	False
507	60295381	China	Tianjin	60294857	China	Tianjin	Asymchem Laboratories (Tianjin) Co., Ltd., Tianjin	Asymchem Laboratories (Tianjin) Co., Ltd, Tianjin	asymchem|laboratories|tianjin|tianjin	asymchem|laboratories|tianjin|tianjin	1.0	False
508	60294857	China	Tianjin	60295381	China	Tianjin	Asymchem Laboratories (Tianjin) Co., Ltd, Tianjin	Asymchem Laboratories (Tianjin) Co., Ltd., Tianjin	asymchem|laboratories|tianjin|tianjin	asymchem|laboratories|tianjin|tianjin	1.0	False
509	60319342	Ireland	Ringaskiddy	60294477	Ireland	Ringaskiddy	Hovione Scientia Limited, Ringaskiddy	Hovione Scientia Limited, Ringaskiddy	hovione|scientia|limited|ringaskiddy	hovione|scientia|limited|ringaskiddy	1.0	False
510	60294477	Ireland	Ringaskiddy	60319342	Ireland	Ringaskiddy	Hovione Scientia Limited, Ringaskiddy	Hovione Scientia Limited, Ringaskiddy	hovione|scientia|limited|ringaskiddy	hovione|scientia|limited|ringaskiddy	1.0	False
511	60302064	United States	Plano	60294539	United States	Plano	Reata Pharmaceuticals, Inc., Plano	Reata Pharmaceuticals, Inc, Plano	reata|pharmaceuticals|plano	reata|pharmaceuticals|plano	1.0	False
512	60294539	United States	Plano	60302064	United States	Plano	Reata Pharmaceuticals, Inc, Plano	Reata Pharmaceuticals, Inc., Plano	reata|pharmaceuticals|plano	reata|pharmaceuticals|plano	1.0	False
513	60295580	Japan	Tokyo	60324145	Japan	Tokyo	Oriciro Genomics, Inc., Tokyo	Oriciro Genomics Inc., Tokyo	oriciro|genomics|tokyo	oriciro|genomics|tokyo	1.0	False
514	60324145	Japan	Tokyo	60295580	Japan	Tokyo	Oriciro Genomics Inc., Tokyo	Oriciro Genomics, Inc., Tokyo	oriciro|genomics|tokyo	oriciro|genomics|tokyo	1.0	False
515	60299548	United States	San Jose	60098319	United States	San Jose	PayPal, Inc., San Jose	PayPal, San Jose	paypal|san|jose	paypal|san|jose	1.0	False
516	60300550	Finland	Helsinki	60018778	Finland	Helsinki	Valio Ltd, Helsinki	Valio Ltd., Helsinki	valio|helsinki	valio|helsinki	1.0	False
517	60300550	Finland	Helsinki	60018778	Finland	Helsinki	Valio Ltd, Helsinki	Valio, Helsinki	valio|helsinki	valio|helsinki	1.0	False
518	60340177	Japan	Kariya	60107322	Japan	Kariya	Toyoda Automatic Loom Works, Ltd., Kariya	Toyoda Automatic Loom Works, Ltd., Kariya	toyoda|automatic|loom|works|kariya	toyoda|automatic|loom|works|kariya	1.0	False
519	60297014	Japan	Kariya	60002716	Japan	Kariya	Aisin Seiki Co., Ltd., Kariya	Aisin Seiki, Kariya	aisin|seiki|kariya	aisin|seiki|kariya	1.0	False
520	60311878	United Kingdom	Hertford	60298980	United Kingdom	Hertford	DIOSynVax, Hertford	Diosynvax Ltd, Hertford	diosynvax|hertford	diosynvax|hertford	1.0	False
521	60298980	United Kingdom	Hertford	60311878	United Kingdom	Hertford	Diosynvax Ltd, Hertford	DIOSynVax, Hertford	diosynvax|hertford	diosynvax|hertford	1.0	False
522	60303980	Germany	Jena	60087906	Germany	Jena	Jenoptik AG, Jena	JENOPTIK AG, Jena	jenoptik|ag|jena	jenoptik|ag|jena	1.0	False
523	60297539	United States	New York	60297538	United States	New York	N-Gene Research Laboratories, Inc., New York	N-Gene Research Laboratories Inc., New York	n|gene|research|laboratories|new|york	n|gene|research|laboratories|new|york	1.0	False
524	60297538	United States	New York	60297539	United States	New York	N-Gene Research Laboratories Inc., New York	N-Gene Research Laboratories, Inc., New York	n|gene|research|laboratories|new|york	n|gene|research|laboratories|new|york	1.0	False
525	60089927	China	Weinan	60278464	China	Weinan	Weinan Teachers University, Weinan	Weinan Teachers University, Weinan	weinan|teachers|university|weinan	weinan|teachers|university|weinan	1.0	False
526	60094599	South Korea	Icheon	60319409	South Korea	Icheon	Hyundai Electronics Industries Co., Ltd., Icheon	Hyundai Electronics Industries Co Ltd, Icheon	hyundai|electronics|industries|icheon	hyundai|electronics|industries|icheon	1.0	False
527	60091808	United States	Bremerton	60026461	United States	Bremerton	Diagnostic Specialties Laboratory, Inc., Bremerton	Diagnostic Specialties Laboratory - Bremerton, Bremerton	diagnostic|specialties|laboratory|bremerton	diagnostic|specialties|laboratory|bremerton|bremerton	1.0	False
528	60100563	New Zealand	Auckland	60313236	New Zealand	Auckland	Genesis Research & Development Corporation Ltd, Auckland	Genesis Research and Development Corporation Ltd, Auckland	genesis|research|development|corporation|auckland	genesis|research|development|corporation|auckland	1.0	False
529	60091368	Japan	Chigasaki	60311718	Japan	Chigasaki	ULVAC-PHI, Inc., Chigasaki	Ulvac-Phi, Chigasaki	ulvac|phi|chigasaki	ulvac|phi|chigasaki	1.0	False
530	60098680	United States	Greenwood Village	60298252	United States	Greenwood Village	Molycorp Minerals, LLC, Greenwood Village	Molycorp Minerals LLC, Greenwood Village	molycorp|minerals|llc|greenwood|village	molycorp|minerals|llc|greenwood|village	1.0	False
531	60100208	China	Wuhan	60262981	China	Wuhan	Wuhan University of Science and Engineering, Wuhan	Wuhan University of Engineering Science, Wuhan	wuhan|university|science|engineering|wuhan	wuhan|university|engineering|science|wuhan	1.0	False
532	60090415	United States	Kirkland	60295335	United States	Kirkland	ProteoTech, Inc., Kirkland	ProteoTech Inc, Kirkland	proteotech|kirkland	proteotech|kirkland	1.0	False
533	60090419	United States	Watertown	60295444	United States	Watertown	AmberGen, Inc., Watertown	Ambergen Inc., Watertown	ambergen|watertown	ambergen|watertown	1.0	False
534	60099773	United States	Ithaca	60316378	United States	Ithaca	Syracuse Bioanalytical Inc., Ithaca	Syracuse Bioanalytical, Ithaca	syracuse|bioanalytical|ithaca	syracuse|bioanalytical|ithaca	1.0	False
535	60093580	South Korea	Seoul	60313585	South Korea	Seoul	Daewoong Pharmaceutical Co., Ltd., Seoul	Daewoong Pharmaceutical Co.,Ltd., Seoul	daewoong|pharmaceutical|seoul	daewoong|pharmaceutical|seoul	1.0	False
536	60088718	Chile	Santiago	60212030	Chile	Santiago	School of Medicine, Santiago	School of Medicine, Santiago	school|medicine|santiago	school|medicine|santiago	1.0	False
537	60097264	India	Namakkal	60292333	India	Namakkal	Paavai Engineering College, Namakkal	Paavai College of Engineering, Namakkal	paavai|engineering|college|namakkal	paavai|college|engineering|namakkal	1.0	False
538	60085882	Turkey	Istanbul	60280335	Turkey	Istanbul	GATA  Haydarpaşa Eğitim Hastanesi Komutanlığı, Istanbul	GATA  Haydarpaşa Eğitim Hastanesi Komutanlığı, Istanbul	gata|haydarpa|e|itim|hastanesi|komutanl|istanbul	gata|haydarpa|e|itim|hastanesi|komutanl|istanbul	1.0	False
539	60086106	Poland	Warsaw	60088499	Poland	Warsaw	Wydział Biologii Uniwersytetu Warszawskiego, Warsaw	Wydział Biologii, Uniwersytetu Warszawskiego, Warsaw	wydzia|biologii|uniwersytetu|warszawskiego|warsaw	wydzia|biologii|uniwersytetu|warszawskiego|warsaw	1.0	False
540	60088499	Poland	Warsaw	60086106	Poland	Warsaw	Wydział Biologii, Uniwersytetu Warszawskiego, Warsaw	Wydział Biologii Uniwersytetu Warszawskiego, Warsaw	wydzia|biologii|uniwersytetu|warszawskiego|warsaw	wydzia|biologii|uniwersytetu|warszawskiego|warsaw	1.0	False
541	60090106	Taiwan	Tainan	60274278	Taiwan	Tainan	CTBC Business School, Tainan	CTBC Business School, Tainan	ctbc|business|school|tainan	ctbc|business|school|tainan	1.0	False
542	60098319	United States	San Jose	60299548	United States	San Jose	PayPal, San Jose	PayPal, Inc., San Jose	paypal|san|jose	paypal|san|jose	1.0	False
543	60100747	United States	Springfield	60007080	United States	Springfield	St. John's Hospital, Springfield	St. John's Hospital, Springfield	st|john|s|hospital|springfield	st|john|s|hospital|springfield	1.0	False
544	60087906	Germany	Jena	60303980	Germany	Jena	JENOPTIK AG, Jena	Jenoptik AG, Jena	jenoptik|ag|jena	jenoptik|ag|jena	1.0	False
545	60029533	Saudi Arabia	Riyadh	60231076	Saudi Arabia	Riyadh	College of Medicine, Riyadh	College of Medicine, Riyadh	college|medicine|riyadh	college|medicine|riyadh	1.0	False
546	60029533	Saudi Arabia	Riyadh	60218948	Saudi Arabia	Riyadh	College of Medicine, Riyadh	College of Medicine-Riyadh, Riyadh	college|medicine|riyadh	college|medicine|riyadh|riyadh	1.0	False
547	60019904	France	Palaiseau	60288614	France	Palaiseau	École Nationale Supérieure de Techniques Avancées, Palaiseau	École Nationale Supérieure de Techniques Avancées, Palaiseau	cole|nationale|sup|rieure|de|techniques|avanc|es|palaiseau	cole|nationale|sup|rieure|de|techniques|avanc|es|palaiseau	1.0	False
548	60031513	Japan	Tsukuba	60010471	Japan	Tsukuba	National Institute of Agrobiological Resources, Tsukuba	National Institute of Agrobiological Resources, Tsukuba	national|institute|agrobiological|resources|tsukuba	national|institute|agrobiological|resources|tsukuba	1.0	False
549	60023832	Japan	Tokyo	60032544	Japan	Tokyo	National Hospital Medical Center, Tokyo	National Hospital Tokyo Medical Center, Tokyo	national|hospital|medical|center|tokyo	national|hospital|tokyo|medical|center|tokyo	1.0	False
550	60019904	France	Palaiseau	60288614	France	Palaiseau	National School of Advanced Techniques, Palaiseau	National School of Advanced Techniques, Palaiseau	national|school|advanced|techniques|palaiseau	national|school|advanced|techniques|palaiseau	1.0	False
551	60021209	United States	Albany	60160819	United States	Albany	National Energy Technology Laboratory, Albany, Albany	National Energy Technology Laboratory, Albany	national|energy|technology|laboratory|albany|albany	national|energy|technology|laboratory|albany	1.0	False
552	60030300	Sweden	Stockholm	60111257	Sweden	Stockholm	Sophiahemmet Queen Sophia Hospital Sweden, Stockholm	Sophiahemmet Queen Sophia Hospital Sweden, Stockholm	sophiahemmet|queen|sophia|hospital|sweden|stockholm	sophiahemmet|queen|sophia|hospital|sweden|stockholm	1.0	False
553	60020436	Egypt	Cairo	60015323	Egypt	Cairo	Faculty of Medicine, Cairo	Faculty of Medicine, Cairo	faculty|medicine|cairo	faculty|medicine|cairo	1.0	False
554	60020436	Egypt	Cairo	60274270	Egypt	Cairo	Faculty of Medicine, Cairo	Faculty of Medicine, Cairo	faculty|medicine|cairo	faculty|medicine|cairo	1.0	False
555	60020436	Egypt	Cairo	60024697	Egypt	Cairo	Faculty of Medicine, Cairo	Faculty of Medicine, Cairo	faculty|medicine|cairo	faculty|medicine|cairo	1.0	False
556	60016246	Egypt	Alexandria	60273047	Egypt	Alexandria	Faculty of Pharmacy, Alexandria	Faculty of Pharmacy, Alexandria	faculty|pharmacy|alexandria	faculty|pharmacy|alexandria	1.0	False
557	60024697	Egypt	Cairo	60015323	Egypt	Cairo	Faculty of Medicine, Cairo	Faculty of Medicine, Cairo	faculty|medicine|cairo	faculty|medicine|cairo	1.0	False
558	60024697	Egypt	Cairo	60274270	Egypt	Cairo	Faculty of Medicine, Cairo	Faculty of Medicine, Cairo	faculty|medicine|cairo	faculty|medicine|cairo	1.0	False
559	60024697	Egypt	Cairo	60020436	Egypt	Cairo	Faculty of Medicine, Cairo	Faculty of Medicine, Cairo	faculty|medicine|cairo	faculty|medicine|cairo	1.0	False
560	60018219	Iran	Tehran	60013786	Iran	Tehran	Infectious Diseases and Tropical Medicine Research Center Joundishapour, Tehran	Infectious Diseases and Tropical Medicine Research Center Joundishapour, Tehran	infectious|diseases|tropical|medicine|research|center|joundishapour|tehran	infectious|diseases|tropical|medicine|research|center|joundishapour|tehran	1.0	False
561	60018670	United States	Cranbury	60307965	United States	Cranbury	Princeton Lightwave, Inc., Cranbury	Princeton Lightwave Inc, Cranbury	princeton|lightwave|cranbury	princeton|lightwave|cranbury	1.0	False
562	60022958	Sweden	Sundsvall	60106597	Sweden	Sundsvall	Mid Sweden University, Sundsvall	Mid Sweden University, Sundsvall, Sundsvall	mid|sweden|university|sundsvall	mid|sweden|university|sundsvall|sundsvall	1.0	False
563	60028507	United States	Ipswich	60297599	United States	Ipswich	New England Biolabs, Ipswich	New England Biolabs, Inc., Ipswich	new|england|biolabs|ipswich	new|england|biolabs|ipswich	1.0	False
564	60029867	United States	Chicago	60009535	United States	Chicago	Roosevelt University Chicago, Chicago	Roosevelt University, Chicago	roosevelt|university|chicago|chicago	roosevelt|university|chicago	1.0	False
565	60021121	United States	Bloomington	60138445	United States	Bloomington	Indiana University Bloomington, Bloomington	Indiana University, Bloomington	indiana|university|bloomington|bloomington	indiana|university|bloomington	1.0	False
566	60026461	United States	Bremerton	60091808	United States	Bremerton	Diagnostic Specialties Laboratory - Bremerton, Bremerton	Diagnostic Specialties Laboratory, Inc., Bremerton	diagnostic|specialties|laboratory|bremerton|bremerton	diagnostic|specialties|laboratory|bremerton	1.0	False
567	60031142	Spain	Cordoba	60032936	Argentina	Cordoba	Hospital Universitario Reina Sofia, Cordoba	Hospital Universitario Reina Sofia, Cordoba, Cordoba	hospital|universitario|reina|sofia|cordoba	hospital|universitario|reina|sofia|cordoba|cordoba	1.0	False
568	60016890	Spain	Madrid	60013823	Spain	Madrid	Hospital Materno-Infantil, Madrid	Hospital Materno Infantil, Madrid	hospital|materno|infantil|madrid	hospital|materno|infantil|madrid	1.0	False
569	60028902	Spain	Madrid	60068653	Spain	Madrid	Instituto de Plasticos y Caucho, Madrid	Instituto de Plasticos y Caucho, Madrid	instituto|de|plasticos|y|caucho|madrid	instituto|de|plasticos|y|caucho|madrid	1.0	False
570	60028902	Spain	Madrid	60068653	Spain	Madrid	Instituto de Ciencia y Tecnología de Polímeros, Madrid	Instituto de Ciencia y Tecnología de Polímeros, Madrid	instituto|de|ciencia|y|tecnolog|de|pol|meros|madrid	instituto|de|ciencia|y|tecnolog|de|pol|meros|madrid	1.0	False
571	60026540	Not Define (xd)		60017421	Not Define (xd)		Institute of Molecular Genetics, 	Institute for Molecular Genetics, 	institute|molecular|genetics	institute|molecular|genetics	1.0	False
572	60017421	Not Define (xd)		60026540	Not Define (xd)		Institute for Molecular Genetics, 	Institute of Molecular Genetics, 	institute|molecular|genetics	institute|molecular|genetics	1.0	False
573	60023967	Not Define (xd)		60009820	Not Define (xd)		Institute for Protein Research, 	Institute of Protein Research, 	institute|protein|research	institute|protein|research	1.0	False
574	60022266	Not Define (xd)		60014779	Not Define (xd)		Institute for Immunology, 	Institute of Immunology, 	institute|immunology	institute|immunology	1.0	False
575	60019347	United States	San Antonio	60003064	United States	San Antonio	Institute for Drug Development, San Antonio	Institute for Drug Development San Antonio, San Antonio	institute|drug|development|san|antonio	institute|drug|development|san|antonio|san|antonio	1.0	False
576	60021054	Germany	Dortmund	60267653	Germany	Dortmund	International School of Management ISM Dortmund, Dortmund	International School of Management (ISM), Dortmund	international|school|management|ism|dortmund|dortmund	international|school|management|ism|dortmund	1.0	False
577	60021054	Germany	Dortmund	60267653	Germany	Dortmund	International School of Management ISM, Dortmund, Dortmund	International School of Management (ISM), Dortmund	international|school|management|ism|dortmund|dortmund	international|school|management|ism|dortmund	1.0	False
578	60021778	Italy	Bari	60113709	Austria	Bari	Istituto Di Genetica Vegetale, Bari, Bari	Istituto di Genetica Vegetale, Bari, Bari	istituto|di|genetica|vegetale|bari|bari	istituto|di|genetica|vegetale|bari|bari	1.0	False
579	60016890	Spain	Madrid	60013823	Spain	Madrid	Maternal and child Hospital, Madrid	Maternal and child Hospital, Madrid	maternal|child|hospital|madrid	maternal|child|hospital|madrid	1.0	False
580	60028414	United States	Waltham	60313210	United States	Waltham	GelTex Pharmaceuticals, Inc., Waltham	GelTex Pharmaceuticals Inc., Waltham	geltex|pharmaceuticals|waltham	geltex|pharmaceuticals|waltham	1.0	False
581	60022458	India	Chandigarh	60117303	India	Chandigarh	PEC University of Technology, Chandigarh	PEC University of Technology, Chandigarh	pec|university|technology|chandigarh	pec|university|technology|chandigarh	1.0	False
582	60025926	Canada	Edmonton	60117268	Canada	Edmonton	Grant MacEwan College, Edmonton	Grant MacEwan College, Edmonton	grant|macewan|college|edmonton	grant|macewan|college|edmonton	1.0	False
583	60028150	Not Define (xd)		60009695	Not Define (xd)		Graduate School of Science and Engineering, 	Graduate School of Engineering Science, 	graduate|school|science|engineering	graduate|school|engineering|science	1.0	False
584	60023383	Chile	Santiago	60012464	Chile	Santiago	Universidad de Santiago de Chile, Santiago	Universidad de Chile, Santiago	universidad|de|santiago|de|chile|santiago	universidad|de|chile|santiago	1.0	False
585	60023383	Chile	Santiago	60012464	Chile	Santiago	University of Santiago, Chile, Santiago	University of Chile, Santiago	university|santiago|chile|santiago	university|chile|santiago	1.0	False
586	60017053	United States	Missoula	60022355	United States	Missoula	University of Montana Missoula, Missoula	University of Montana, Missoula	university|montana|missoula|missoula	university|montana|missoula	1.0	False
587	60023195	Chile	Concepcion	60012683	Chile	Concepcion	Universidad del Bio Bio, Concepcion	Universidad del Bio Bio, Concepcion, Concepcion	universidad|del|bio|bio|concepcion	universidad|del|bio|bio|concepcion|concepcion	1.0	False
588	60029954	Chile	Osorno	60007572	Chile	Osorno	Universidad de Los Lagos, Osorno, Osorno	Universidad de Los Lagos, Osorno	universidad|de|los|lagos|osorno|osorno	universidad|de|los|lagos|osorno	1.0	False
589	60031233	United States	Atlanta	60304214	United States	Atlanta	United Parcel Service, Atlanta	United Parcel Service Inc, Atlanta	united|parcel|service|atlanta	united|parcel|service|atlanta	1.0	False
590	60022355	United States	Missoula	60017053	United States	Missoula	University of Montana, Missoula	University of Montana Missoula, Missoula	university|montana|missoula	university|montana|missoula|missoula	1.0	False
591	60021025	United States	Providence	60136555	United States	Providence	Providence VA Medical Center, Providence	Providence VA Medical Center, Providence	providence|va|medical|center|providence	providence|va|medical|center|providence	1.0	False
592	60028498	Germany	Berlin	60279372	Germany	Berlin	Berlin University of Applied Sciences, Berlin	Berlin University of Applied Sciences, Berlin	berlin|university|applied|sciences|berlin	berlin|university|applied|sciences|berlin	1.0	False
593	60022692	Greece	Arta	60082437	Greece	Arta	Technological Educational Institute of Epirus, Arta	Technological Educational Institute of Epirus, Arta	technological|educational|institute|epirus|arta	technological|educational|institute|epirus|arta	1.0	False
594	60030997	United States	Rindge	60010765	United States	Rindge	Franklin Pierce College, Rindge	Franklin Pierce College Rindge, Rindge	franklin|pierce|college|rindge	franklin|pierce|college|rindge|rindge	1.0	False
595	60022340	United States	Princeton	60315126	United States	Princeton	David Sarnoff Research Center, Princeton	David Sarnoff Research Center, Inc., Princeton	david|sarnoff|research|center|princeton	david|sarnoff|research|center|princeton	1.0	False
596	60023439	United States	Reno	60003678	United States	Reno	Desert Research Institute, Reno	Desert Research Institute Reno, Reno	desert|research|institute|reno	desert|research|institute|reno|reno	1.0	False
597	60029378	United States	Long Beach	60033080	United States	Long Beach	Cal State Long Beach, Long Beach	Cal State, Long Beach	cal|state|long|beach|long|beach	cal|state|long|beach	1.0	False
598	60019291	United States	Rochester Hills	60312817	United States	Rochester Hills	Energy Conversion Devices Inc, Rochester Hills	Energy Conversion Devices, Inc., Rochester Hills	energy|conversion|devices|rochester|hills	energy|conversion|devices|rochester|hills	1.0	False
599	60024780	United States	Santa Clara	60304371	United States	Santa Clara	Agilent Technologies, Santa Clara	Agilent Technologies, Inc., Santa Clara	agilent|technologies|santa|clara	agilent|technologies|santa|clara	1.0	False
600	60023149	Germany	Riedstadt	60027097	Germany	Riedstadt	Zentrum für Soziale Psychiatrie PhilippsHospital Riedstadt, Riedstadt	Zentrum für Soziale Psychiatrie PhilippsHospital, Riedstadt	zentrum|f|r|soziale|psychiatrie|philippshospital|riedstadt|riedstadt	zentrum|f|r|soziale|psychiatrie|philippshospital|riedstadt	1.0	False
601	60027097	Germany	Riedstadt	60023149	Germany	Riedstadt	Zentrum für Soziale Psychiatrie PhilippsHospital, Riedstadt	Zentrum für Soziale Psychiatrie PhilippsHospital Riedstadt, Riedstadt	zentrum|f|r|soziale|psychiatrie|philippshospital|riedstadt	zentrum|f|r|soziale|psychiatrie|philippshospital|riedstadt|riedstadt	1.0	False
602	60028025	Japan	Tokyo	60301599	Japan	Tokyo	Asahi Breweries, Ltd., Tokyo	Asahi Breweries, Tokyo	asahi|breweries|tokyo	asahi|breweries|tokyo	1.0	False
603	60028025	Japan	Tokyo	60301599	Japan	Tokyo	Asahi Breweries Ltd., Tokyo	Asahi Breweries, Tokyo	asahi|breweries|tokyo	asahi|breweries|tokyo	1.0	False
604	60031785	Japan	Tokyo	60295772	Japan	Tokyo	Asahi Glass, Tokyo	Asahi Glass Co., Ltd., Tokyo	asahi|glass|tokyo	asahi|glass|tokyo	1.0	False
605	60027633	United States	McMinnville	60012675	United States	McMinnville	Linfield College McMinnville, McMinnville	Linfield College, McMinnville	linfield|college|mcminnville|mcminnville	linfield|college|mcminnville	1.0	False
606	60019559	Ireland	Dublin	60216192	Ireland	Dublin	School of Medicine, Dublin	School of Medicine, Dublin	school|medicine|dublin	school|medicine|dublin	1.0	False
607	60030444	United States	Ogden	60022502	United States	Ogden	Weber State University Ogden, Ogden	Weber State University, Ogden	weber|state|university|ogden|ogden	weber|state|university|ogden	1.0	False
608	60022502	United States	Ogden	60030444	United States	Ogden	Weber State University, Ogden	Weber State University Ogden, Ogden	weber|state|university|ogden	weber|state|university|ogden|ogden	1.0	False
609	60025392	Iran	Tehran	60007790	Iran	Tehran	School of Medicine, Tehran	School of Medicine, Tehran	school|medicine|tehran	school|medicine|tehran	1.0	False
610	60024767	France	Toulouse	60210993	France	Toulouse	Centre d'Etudes Spatiales de la Biosphère, Toulouse	Centre d'Etudes Spatiales de la Biosphère, Toulouse	centre|d|etudes|spatiales|de|la|biosph|re|toulouse	centre|d|etudes|spatiales|de|la|biosph|re|toulouse	1.0	False
611	60026146	India	Visakhapatnam	60117282	India	Visakhapatnam	GITAM University, Visakhapatnam	GITAM university, Visakhapatnam	gitam|university|visakhapatnam	gitam|university|visakhapatnam	1.0	False
