	set1_id	set1_country	set1_city	set2_id	set2_country	set2_city	set1_orgname_with_city	set2_orgname_with_city	set1_tokens	set2_tokens	similarity	id_match
243	60304292	United States	Cambridge	60303400	United States	Cambridge	Good Start Genetics Inc., Cambridge	Good Start Genetics, Inc., Cambridge	good|start|genetics|cambridge	good|start|genetics|cambridge	1.0	False
244	60287929	Poland	Wrocław	60117470	Poland	Wroclaw	Agricultural University of Wroclaw, Wrocław	Agricultural University of Wrocław, Wroclaw	agricultural|university|wroclaw|wroc|aw	agricultural|university|wroc|aw|wroclaw	1.0	False
245	60319496	United States	Morrisville	60310855	United States	Morrisville	Locus Biosciences, Inc, Morrisville	Locus Biosciences, Inc., Morrisville	locus|biosciences|morrisville	locus|biosciences|morrisville	1.0	False
246	60310855	United States	Morrisville	60319496	United States	Morrisville	Locus Biosciences, Inc., Morrisville	Locus Biosciences, Inc, Morrisville	locus|biosciences|morrisville	locus|biosciences|morrisville	1.0	False
247	60300574	United States	Willmar	60298642	United States	Willmar	Epitopix LLC, Willmar	Epitopix, LLC, Willmar	epitopix|llc|willmar	epitopix|llc|willmar	1.0	False
248	60298642	United States	Willmar	60300574	United States	Willmar	Epitopix, LLC, Willmar	Epitopix LLC, Willmar	epitopix|llc|willmar	epitopix|llc|willmar	1.0	False
249	60311718	Japan	Chigasaki	60091368	Japan	Chigasaki	Ulvac-Phi, Chigasaki	ULVAC-PHI, Inc., Chigasaki	ulvac|phi|chigasaki	ulvac|phi|chigasaki	1.0	False
250	60304082	United Kingdom	Oldbury	60302358	United Kingdom	Oldbury	Rhodia Consumer Specialties Ltd., Oldbury	Rhodia Consumer Specialties Ltd, Oldbury	rhodia|consumer|specialties|oldbury	rhodia|consumer|specialties|oldbury	1.0	False
251	60317654	United States	Collegeville	60011531	United States	Collegeville	Rhone-Poulenc Rorer, Collegeville	Rhone-Poulenc Rorer Inc, Collegeville	rhone|poulenc|rorer|collegeville	rhone|poulenc|rorer|collegeville	1.0	False
252	60302358	United Kingdom	Oldbury	60304082	United Kingdom	Oldbury	Rhodia Consumer Specialties Ltd, Oldbury	Rhodia Consumer Specialties Ltd., Oldbury	rhodia|consumer|specialties|oldbury	rhodia|consumer|specialties|oldbury	1.0	False
253	60327361	United States	Boston	60312793	United States	Boston	Embark Veterinary, Inc., Boston	Embark Veterinary, Inc, Boston	embark|veterinary|boston	embark|veterinary|boston	1.0	False
254	60312793	United States	Boston	60327361	United States	Boston	Embark Veterinary, Inc, Boston	Embark Veterinary, Inc., Boston	embark|veterinary|boston	embark|veterinary|boston	1.0	False
255	60313210	United States	Waltham	60028414	United States	Waltham	GelTex Pharmaceuticals Inc., Waltham	GelTex Pharmaceuticals, Inc., Waltham	geltex|pharmaceuticals|waltham	geltex|pharmaceuticals|waltham	1.0	False
256	60295418	United States	Pittsburgh	60011920	United States	Pittsburgh	Cellomics Inc., Pittsburgh	Cellomics, Inc., Pittsburgh	cellomics|pittsburgh	cellomics|pittsburgh	1.0	False
257	60294419	Israel	Kfar Saba	60294942	Ireland	Kfar Saba	Cellect Biotechnology Ltd., Kfar Saba	Cellect Biotechnology, Inc., Kfar Saba	cellect|biotechnology|kfar|saba	cellect|biotechnology|kfar|saba	1.0	False
258	60294942	Ireland	Kfar Saba	60294419	Israel	Kfar Saba	Cellect Biotechnology, Inc., Kfar Saba	Cellect Biotechnology Ltd., Kfar Saba	cellect|biotechnology|kfar|saba	cellect|biotechnology|kfar|saba	1.0	False
259	60311937	United Kingdom	London	60297968	United Kingdom	London	Thorn EMI Plc, London	Thorn EMI plc, London	thorn|emi|plc|london	thorn|emi|plc|london	1.0	False
260	60301725	United States	Sarasota	60294221	United States	Sarasota	DNAPrint Genomics Inc., Sarasota	DNAPrint Genomics, Inc., Sarasota	dnaprint|genomics|sarasota	dnaprint|genomics|sarasota	1.0	False
261	60294221	United States	Sarasota	60301725	United States	Sarasota	DNAPrint Genomics, Inc., Sarasota	DNAPrint Genomics Inc., Sarasota	dnaprint|genomics|sarasota	dnaprint|genomics|sarasota	1.0	False
262	60297968	United Kingdom	London	60311937	United Kingdom	London	Thorn EMI plc, London	Thorn EMI Plc, London	thorn|emi|plc|london	thorn|emi|plc|london	1.0	False
263	60298252	United States	Greenwood Village	60098680	United States	Greenwood Village	Molycorp Minerals LLC, Greenwood Village	Molycorp Minerals, LLC, Greenwood Village	molycorp|minerals|llc|greenwood|village	molycorp|minerals|llc|greenwood|village	1.0	False
264	60309027	Germany	Berlin	60116396	Germany	Berlin	Nanofluor GmbH, Berlin	nanofluor GmbH, Berlin	nanofluor|gmbh|berlin	nanofluor|gmbh|berlin	1.0	False
265	60311263	United States	Pasadena	60308889	United States	Pasadena	Nanostream Inc., Pasadena	Nanostream, Inc., Pasadena	nanostream|pasadena	nanostream|pasadena	1.0	False
266	60297552	South Korea	Jincheon-gun	60301458	South Korea	Jincheon-gun	Nano Intelligent Biomedical Engineering Corporation, Jincheon-gun	Nano Intelligent Biomedical Engineering Corporation Co. Ltd., Jincheon-gun	nano|intelligent|biomedical|engineering|corporation|jincheon|gun	nano|intelligent|biomedical|engineering|corporation|jincheon|gun	1.0	False
267	60318217	United States	Troy	60295099	United States	Troy	NanoPharmaceuticals LLC, Troy	Nanopharmaceuticals LLC, Troy	nanopharmaceuticals|llc|troy	nanopharmaceuticals|llc|troy	1.0	False
268	60311252	China	Nanchang	60300139	China	Nanchang	Nanchang Virtual Reality Institute Co., Ltd., Nanchang	Nanchang Institute of Virtual Reality Co., Ltd., Nanchang	nanchang|virtual|reality|institute|nanchang	nanchang|institute|virtual|reality|nanchang	1.0	False
269	60308889	United States	Pasadena	60311263	United States	Pasadena	Nanostream, Inc., Pasadena	Nanostream Inc., Pasadena	nanostream|pasadena	nanostream|pasadena	1.0	False
270	60295099	United States	Troy	60318217	United States	Troy	Nanopharmaceuticals LLC, Troy	NanoPharmaceuticals LLC, Troy	nanopharmaceuticals|llc|troy	nanopharmaceuticals|llc|troy	1.0	False
271	60300139	China	Nanchang	60311252	China	Nanchang	Nanchang Institute of Virtual Reality Co., Ltd., Nanchang	Nanchang Virtual Reality Institute Co., Ltd., Nanchang	nanchang|institute|virtual|reality|nanchang	nanchang|virtual|reality|institute|nanchang	1.0	False
272	60301458	South Korea	Jincheon-gun	60297552	South Korea	Jincheon-gun	Nano Intelligent Biomedical Engineering Corporation Co. Ltd., Jincheon-gun	Nano Intelligent Biomedical Engineering Corporation, Jincheon-gun	nano|intelligent|biomedical|engineering|corporation|jincheon|gun	nano|intelligent|biomedical|engineering|corporation|jincheon|gun	1.0	False
273	60304625	United States	Ivyland	60295040	United States	Ivyland	Lifelens Technologies, Inc., Ivyland	LifeLens Technologies, Inc, Ivyland	lifelens|technologies|ivyland	lifelens|technologies|ivyland	1.0	False
274	60298582	United States	Brentwood	60122480	United States	Brentwood	Lifepoint Health, Inc, Brentwood	LifePoint Health, Inc., Brentwood	lifepoint|health|brentwood	lifepoint|health|brentwood	1.0	False
275	60295040	United States	Ivyland	60304625	United States	Ivyland	LifeLens Technologies, Inc, Ivyland	Lifelens Technologies, Inc., Ivyland	lifelens|technologies|ivyland	lifelens|technologies|ivyland	1.0	False
276	60314692	United States	New York	60318203	United States	New York	Multex.com, Inc., New York	Multex Com Inc, New York	multex|com|new|york	multex|com|new|york	1.0	False
277	60318203	United States	New York	60314692	United States	New York	Multex Com Inc, New York	Multex.com, Inc., New York	multex|com|new|york	multex|com|new|york	1.0	False
278	60304214	United States	Atlanta	60031233	United States	Atlanta	United Parcel Service Inc, Atlanta	United Parcel Service, Atlanta	united|parcel|service|atlanta	united|parcel|service|atlanta	1.0	False
279	60289933	Indonesia	Padang	60279331	Indonesia	Padang	Universitas Islam Negeri Imam Bonjol, Padang	Universitas Islam Negeri Imam Bonjol Padang, Padang	universitas|islam|negeri|imam|bonjol|padang	universitas|islam|negeri|imam|bonjol|padang|padang	1.0	False
280	60289933	Indonesia	Padang	60279331	Indonesia	Padang	Universitas Islam Negeri Imam Bonjol Padang, Padang	Universitas Islam Negeri Imam Bonjol Padang, Padang	universitas|islam|negeri|imam|bonjol|padang|padang	universitas|islam|negeri|imam|bonjol|padang|padang	1.0	False
281	60281124	Oman	Muscat	60118536	Oman	Muscat	University of Technology and Applied Sciences, Muscat	University of Technology and Applied Sciences-Muscat, Muscat	university|technology|applied|sciences|muscat	university|technology|applied|sciences|muscat|muscat	1.0	False
282	60281124	Oman	Muscat	60118536	Oman	Muscat	University of Technology and Applied Sciences, Muscat	University of Technology and Applied Sciences Muscat, Muscat	university|technology|applied|sciences|muscat	university|technology|applied|sciences|muscat|muscat	1.0	False
283	60320145	China	Zhangjiagang	60319053	China	Zhangjiagang	Lianfeng Steel Zhangjiagang Co. Ltd., Zhangjiagang	Lianfeng Steel Zhangjiagang Co, Zhangjiagang	lianfeng|steel|zhangjiagang|zhangjiagang	lianfeng|steel|zhangjiagang|zhangjiagang	1.0	False
284	60291713	Morocco	Casablanca	60170292	Morocco	Casablanca	Université Mohammed VI des Sciences et de la Santé – UM6SS, Casablanca	Université Mohammed VI des Sciences et de la Santé, Casablanca	universit|mohammed|vi|des|sciences|et|de|la|sant|um6ss|casablanca	universit|mohammed|vi|des|sciences|et|de|la|sant|casablanca	0.9534625892455924	False
285	60291713	Morocco	Casablanca	60170292	Morocco	Casablanca	Université Mohammed VI des Sciences et de la Santé – UM6SS, Casablanca	Université Mohammed VI des Sciences et de la Santé (UM6SS), Casablanca	universit|mohammed|vi|des|sciences|et|de|la|sant|um6ss|casablanca	universit|mohammed|vi|des|sciences|et|de|la|sant|um6ss|casablanca	1.0	False
286	60280861	Germany	Landau	60280751	Germany	Koblenz	University of Koblenz-Landau Landau Campus, Landau	University of Koblenz-Landau Koblenz Campus, Koblenz	university|koblenz|landau|landau|campus|landau	university|koblenz|landau|koblenz|campus|koblenz	1.0	False
287	60280861	Germany	Landau	60280751	Germany	Koblenz	Universität Koblenz-Landau Landau Campus, Landau	Universität Koblenz-Landau Koblenz Campus, Koblenz	universit|t|koblenz|landau|landau|campus|landau	universit|t|koblenz|landau|koblenz|campus|koblenz	1.0	False
288	60280026	United States	Reno	60006873	United States	Reno	University of Nevada School of Medicine, Reno	University of Nevada, Reno School of Medicine, Reno	university|nevada|school|medicine|reno	university|nevada|reno|school|medicine|reno	1.0	False
289	60319053	China	Zhangjiagang	60320145	China	Zhangjiagang	Lianfeng Steel Zhangjiagang Co, Zhangjiagang	Lianfeng Steel Zhangjiagang Co. Ltd., Zhangjiagang	lianfeng|steel|zhangjiagang|zhangjiagang	lianfeng|steel|zhangjiagang|zhangjiagang	1.0	False
290	60280751	Germany	Koblenz	60280861	Germany	Landau	University of Koblenz-Landau Koblenz Campus, Koblenz	University of Koblenz-Landau Landau Campus, Landau	university|koblenz|landau|koblenz|campus|koblenz	university|koblenz|landau|landau|campus|landau	1.0	False
291	60280751	Germany	Koblenz	60280861	Germany	Landau	Universität Koblenz-Landau Koblenz Campus, Koblenz	Universität Koblenz-Landau Landau Campus, Landau	universit|t|koblenz|landau|koblenz|campus|koblenz	universit|t|koblenz|landau|landau|campus|landau	1.0	False
292	60297217	United States	Walnut Creek	60298690	United States	Walnut Creek	Sloiron Inc, Walnut Creek	Sloiron, Inc., Walnut Creek	sloiron|walnut|creek	sloiron|walnut|creek	1.0	False
293	60298690	United States	Walnut Creek	60297217	United States	Walnut Creek	Sloiron, Inc., Walnut Creek	Sloiron Inc, Walnut Creek	sloiron|walnut|creek	sloiron|walnut|creek	1.0	False
294	60312460	United States	Pittsboro	60310831	United States	Pittsboro	Biolex Therapeutics, Inc., Pittsboro	Biolex Therapeutics Inc, Pittsboro	biolex|therapeutics|pittsboro	biolex|therapeutics|pittsboro	1.0	False
295	60306625	Germany	Weil am Rhein	60300443	Germany	Weil am Rhein	Conductix-Wampfler GmbH, Weil am Rhein	Conductix-Wampfler Gmbh, Weil am Rhein	conductix|wampfler|gmbh|weil|am|rhein	conductix|wampfler|gmbh|weil|am|rhein	1.0	False
296	60298943	China	Guangzhou	60311427	China	Guangzhou	Bio-Thera Solutions, Ltd., Guangzhou	Bio-Thera Solutions Ltd., Guangzhou	bio|thera|solutions|guangzhou	bio|thera|solutions|guangzhou	1.0	False
297	60310540	China	Qufu	60311292	China	Qufu	Shandong Donghong Pipe Industry Co., Ltd., Qufu	Shandong Donghong Pipe Industry Co., Ltd, Qufu	shandong|donghong|pipe|industry|qufu	shandong|donghong|pipe|industry|qufu	1.0	False
298	60306853	South Korea	Anyang	60298861	South Korea	Anyang	HaplnScience Inc, Anyang	Haplnscience Inc., Anyang	haplnscience|anyang	haplnscience|anyang	1.0	False
299	60310831	United States	Pittsboro	60312460	United States	Pittsboro	Biolex Therapeutics Inc, Pittsboro	Biolex Therapeutics, Inc., Pittsboro	biolex|therapeutics|pittsboro	biolex|therapeutics|pittsboro	1.0	False
300	60297305	Portugal	Cantanhede	60307500	Portugal	Cantanhede	Biomimetx S.A., Cantanhede	BioMimetx S.A., Cantanhede	biomimetx|s|cantanhede	biomimetx|s|cantanhede	1.0	False
301	60311292	China	Qufu	60310540	China	Qufu	Shandong Donghong Pipe Industry Co., Ltd, Qufu	Shandong Donghong Pipe Industry Co., Ltd., Qufu	shandong|donghong|pipe|industry|qufu	shandong|donghong|pipe|industry|qufu	1.0	False
302	60311427	China	Guangzhou	60298943	China	Guangzhou	Bio-Thera Solutions Ltd., Guangzhou	Bio-Thera Solutions, Ltd., Guangzhou	bio|thera|solutions|guangzhou	bio|thera|solutions|guangzhou	1.0	False
303	60309318	China	Shanghai	60311297	China	Shanghai	Shanghai Weipu Chemical Technology Service Co., Ltd., Shanghai	Shanghai WEIPU Chemical Technology Service Co., Ltd., Shanghai	shanghai|weipu|chemical|technology|service|shanghai	shanghai|weipu|chemical|technology|service|shanghai	1.0	False
304	60309689	Germany	Potsdam	60294915	Germany	Potsdam	Biotx.ai, GmbH, Potsdam	biotx.ai GmbH, Potsdam	biotx|ai|gmbh|potsdam	biotx|ai|gmbh|potsdam	1.0	False
305	60341931	Netherlands	Amsterdam	60328239	Netherlands	Amsterdam	Confocal NL, Amsterdam	Confocal.nl, Amsterdam	confocal|nl|amsterdam	confocal|nl|amsterdam	1.0	False
306	60311297	China	Shanghai	60309318	China	Shanghai	Shanghai WEIPU Chemical Technology Service Co., Ltd., Shanghai	Shanghai Weipu Chemical Technology Service Co., Ltd., Shanghai	shanghai|weipu|chemical|technology|service|shanghai	shanghai|weipu|chemical|technology|service|shanghai	1.0	False
307	60300443	Germany	Weil am Rhein	60306625	Germany	Weil am Rhein	Conductix-Wampfler Gmbh, Weil am Rhein	Conductix-Wampfler GmbH, Weil am Rhein	conductix|wampfler|gmbh|weil|am|rhein	conductix|wampfler|gmbh|weil|am|rhein	1.0	False
308	60307500	Portugal	Cantanhede	60297305	Portugal	Cantanhede	BioMimetx S.A., Cantanhede	Biomimetx S.A., Cantanhede	biomimetx|s|cantanhede	biomimetx|s|cantanhede	1.0	False
309	60298861	South Korea	Anyang	60306853	South Korea	Anyang	Haplnscience Inc., Anyang	HaplnScience Inc, Anyang	haplnscience|anyang	haplnscience|anyang	1.0	False
310	60294915	Germany	Potsdam	60309689	Germany	Potsdam	biotx.ai GmbH, Potsdam	Biotx.ai, GmbH, Potsdam	biotx|ai|gmbh|potsdam	biotx|ai|gmbh|potsdam	1.0	False
311	60328239	Netherlands	Amsterdam	60341931	Netherlands	Amsterdam	Confocal.nl, Amsterdam	Confocal NL, Amsterdam	confocal|nl|amsterdam	confocal|nl|amsterdam	1.0	False
312	60295571	United States	San Jose	60319064	United States	San Jose	Light Field Lab, Inc., San Jose	Light Field Lab, San Jose	light|field|lab|san|jose	light|field|lab|san|jose	1.0	False
313	60300433	China	Chongqing	60306643	China	Chongqing	Chongqing Genrix Biopharmaceutical Co Ltd, Chongqing	Chongqing Genrix Biopharmaceutical Co., Ltd, Chongqing	chongqing|genrix|biopharmaceutical|chongqing	chongqing|genrix|biopharmaceutical|chongqing	1.0	False
314	60319064	United States	San Jose	60295571	United States	San Jose	Light Field Lab, San Jose	Light Field Lab, Inc., San Jose	light|field|lab|san|jose	light|field|lab|san|jose	1.0	False
315	60301684	China	Chongqing	60302178	China	Chongqing	Chongqing Ruiyun Technology co., ltd., Chongqing	Chongqing Ruiyun Technology Co., Ltd., Chongqing	chongqing|ruiyun|technology|chongqing	chongqing|ruiyun|technology|chongqing	1.0	False
316	60306643	China	Chongqing	60300433	China	Chongqing	Chongqing Genrix Biopharmaceutical Co., Ltd, Chongqing	Chongqing Genrix Biopharmaceutical Co Ltd, Chongqing	chongqing|genrix|biopharmaceutical|chongqing	chongqing|genrix|biopharmaceutical|chongqing	1.0	False
317	60302178	China	Chongqing	60301684	China	Chongqing	Chongqing Ruiyun Technology Co., Ltd., Chongqing	Chongqing Ruiyun Technology co., ltd., Chongqing	chongqing|ruiyun|technology|chongqing	chongqing|ruiyun|technology|chongqing	1.0	False
318	60296916	China	Nanjing	60311155	China	Nanjing	PharmaBlock Sciences (Nanjing), Inc., Nanjing	PharmaBlock Sciences (Nanjing) Inc., Nanjing	pharmablock|sciences|nanjing|nanjing	pharmablock|sciences|nanjing|nanjing	1.0	False
319	60311155	China	Nanjing	60296916	China	Nanjing	PharmaBlock Sciences (Nanjing) Inc., Nanjing	PharmaBlock Sciences (Nanjing), Inc., Nanjing	pharmablock|sciences|nanjing|nanjing	pharmablock|sciences|nanjing|nanjing	1.0	False
320	60310692	United States	Reno	60309297	United States	Reno	ProThera, Reno	ProThera, Inc., Reno	prothera|reno	prothera|reno	1.0	False
321	60309297	United States	Reno	60310692	United States	Reno	ProThera, Inc., Reno	ProThera, Reno	prothera|reno	prothera|reno	1.0	False
322	60292037	United Kingdom	York	60311537	United States	York	Pro-Cure Therapeutics Ltd., York	Pro-Cure Therapeutics, York	pro|cure|therapeutics|york	pro|cure|therapeutics|york	1.0	False
323	60303079	United Kingdom	Cambridge	60118653	United Kingdom	Cambridge	Prowler.io Limited, Cambridge	PROWLER.io Limited, Cambridge	prowler|io|limited|cambridge	prowler|io|limited|cambridge	1.0	False
324	60311537	United States	York	60292037	United Kingdom	York	Pro-Cure Therapeutics, York	Pro-Cure Therapeutics Ltd., York	pro|cure|therapeutics|york	pro|cure|therapeutics|york	1.0	False
325	60295335	United States	Kirkland	60090415	United States	Kirkland	ProteoTech Inc, Kirkland	ProteoTech, Inc., Kirkland	proteotech|kirkland	proteotech|kirkland	1.0	False
326	60297983	United States	Redlands	60004715	United States	Redlands	Esri, Redlands	ESRI, Redlands	esri|redlands	esri|redlands	1.0	False
327	60318509	United States	New York	60112357	United States	New York	L3 Technologies, New York	L3 Technologies, Inc., New York	l3|technologies|new|york	l3|technologies|new|york	1.0	False
328	60311282	China	Shanghai	60309302	China	Shanghai	Rajax Network Technology Co., Ltd., Shanghai	Rajax Network Technology Co., Ltd, Shanghai	rajax|network|technology|shanghai	rajax|network|technology|shanghai	1.0	False
329	60293654	United States	Southfield	60078277	United States	Southfield	Federal Mogul Corporation, Southfield	Federal-Mogul Corporation, Southfield	federal|mogul|corporation|southfield	federal|mogul|corporation|southfield	1.0	False
330	60309302	China	Shanghai	60311282	China	Shanghai	Rajax Network Technology Co., Ltd, Shanghai	Rajax Network Technology Co., Ltd., Shanghai	rajax|network|technology|shanghai	rajax|network|technology|shanghai	1.0	False
331	60311501	United States	Denver	60309007	United States	Denver	RavenBrick LLC, Denver	Ravenbrick LLC, Denver	ravenbrick|llc|denver	ravenbrick|llc|denver	1.0	False
332	60309007	United States	Denver	60311501	United States	Denver	Ravenbrick LLC, Denver	RavenBrick LLC, Denver	ravenbrick|llc|denver	ravenbrick|llc|denver	1.0	False
333	60295438	United States	Bothell	60303365	United States	Bothell	Alder Biopharmaceuticals Inc., Bothell	Alder BioPharmaceuticals Inc, Bothell	alder|biopharmaceuticals|bothell	alder|biopharmaceuticals|bothell	1.0	False
334	60303365	United States	Bothell	60295438	United States	Bothell	Alder BioPharmaceuticals Inc, Bothell	Alder Biopharmaceuticals Inc., Bothell	alder|biopharmaceuticals|bothell	alder|biopharmaceuticals|bothell	1.0	False
335	60311416	China	Beijing	60308854	China	Beijing	Beijing Jingdong Qianshi Technology Co., Ltd., Beijing	Beijing Jingdong Qianshi Technology Co.,Ltd, Beijing	beijing|jingdong|qianshi|technology|beijing	beijing|jingdong|qianshi|technology|beijing	1.0	False
336	60311417	China	Beijing	60299836	China	Beijing	Beijing Sankuai Online Technology Co., Ltd., Beijing	Beijing Sankuai Online Technology Co.,Ltd., Beijing	beijing|sankuai|online|technology|beijing	beijing|sankuai|online|technology|beijing	1.0	False
337	60308854	China	Beijing	60311416	China	Beijing	Beijing Jingdong Qianshi Technology Co.,Ltd, Beijing	Beijing Jingdong Qianshi Technology Co., Ltd., Beijing	beijing|jingdong|qianshi|technology|beijing	beijing|jingdong|qianshi|technology|beijing	1.0	False
338	60299836	China	Beijing	60311417	China	Beijing	Beijing Sankuai Online Technology Co.,Ltd., Beijing	Beijing Sankuai Online Technology Co., Ltd., Beijing	beijing|sankuai|online|technology|beijing	beijing|sankuai|online|technology|beijing	1.0	False
339	60296662	United States	Greenwood Village	60115000	United States	Greenwood Village	American Medical Response, Greenwood Village	American Medical Response, Inc., Greenwood Village	american|medical|response|greenwood|village	american|medical|response|greenwood|village	1.0	False
340	60323772	China	Changsha	60320060	China	Changsha	State Grid Hunan Electric Power Co., Ltd., Changsha	State Grid Hunan Electric Power Co Ltd, Changsha	state|grid|hunan|electric|power|changsha	state|grid|hunan|electric|power|changsha	1.0	False
341	60320060	China	Changsha	60323772	China	Changsha	State Grid Hunan Electric Power Co Ltd, Changsha	State Grid Hunan Electric Power Co., Ltd., Changsha	state|grid|hunan|electric|power|changsha	state|grid|hunan|electric|power|changsha	1.0	False
342	60314712	United States	Lakewood	60313145	United States	Lakewood	COBE Laboratories, Inc, Lakewood	COBE Laboratories, Inc., Lakewood	cobe|laboratories|lakewood	cobe|laboratories|lakewood	1.0	False
343	60313145	United States	Lakewood	60314712	United States	Lakewood	COBE Laboratories, Inc., Lakewood	COBE Laboratories, Inc, Lakewood	cobe|laboratories|lakewood	cobe|laboratories|lakewood	1.0	False
344	60293868	Hungary	Debrecen	60297039	Hungary	Debrecen	Fempharma, Debrecen	Fempharma Ltd., Debrecen	fempharma|debrecen	fempharma|debrecen	1.0	False
345	60297039	Hungary	Debrecen	60293868	Hungary	Debrecen	Fempharma Ltd., Debrecen	Fempharma, Debrecen	fempharma|debrecen	fempharma|debrecen	1.0	False
346	60297112	United States	Oakland	60296846	United States	Oakland	Fabric Genomics, Inc., Oakland	Fabric Genomics Inc., Oakland	fabric|genomics|oakland	fabric|genomics|oakland	1.0	False
347	60296846	United States	Oakland	60297112	United States	Oakland	Fabric Genomics Inc., Oakland	Fabric Genomics, Inc., Oakland	fabric|genomics|oakland	fabric|genomics|oakland	1.0	False
348	60284770	Japan	Tokyo	60172569	Japan	Tokyo	Tokyo Medical and Dental University Medical Hospital, Tokyo	Tokyo Medical and Dental University Dental Hospital, Tokyo	tokyo|medical|dental|university|medical|hospital|tokyo	tokyo|medical|dental|university|dental|hospital|tokyo	1.0	False
349	60284770	Japan	Tokyo	60172569	Japan	Tokyo	Tokyo Medical and Dental University Medical Hospital, Tokyo	Tokyo Medical and Dental University, Dental Hospital, Tokyo	tokyo|medical|dental|university|medical|hospital|tokyo	tokyo|medical|dental|university|dental|hospital|tokyo	1.0	False
350	60284770	Japan	Tokyo	60283921	Japan	Tokyo	Tokyo Medical and Dental University Medical Hospital, Tokyo	Tokyo Medical and Dental University Hospital, Tokyo	tokyo|medical|dental|university|medical|hospital|tokyo	tokyo|medical|dental|university|hospital|tokyo	1.0	False
351	60299831	Canada	Toronto	60310275	Canada	Toronto	AntlerA Therapeutics Inc., Toronto	Antlera Therapeutics Inc., Toronto	antlera|therapeutics|toronto	antlera|therapeutics|toronto	1.0	False
352	60310275	Canada	Toronto	60299831	Canada	Toronto	Antlera Therapeutics Inc., Toronto	AntlerA Therapeutics Inc., Toronto	antlera|therapeutics|toronto	antlera|therapeutics|toronto	1.0	False
353	60283921	Japan	Tokyo	60172569	Japan	Tokyo	Tokyo Medical and Dental University Hospital, Tokyo	Tokyo Medical and Dental University Dental Hospital, Tokyo	tokyo|medical|dental|university|hospital|tokyo	tokyo|medical|dental|university|dental|hospital|tokyo	1.0	False
354	60283921	Japan	Tokyo	60172569	Japan	Tokyo	Tokyo Medical and Dental University Hospital, Tokyo	Tokyo Medical and Dental University, Dental Hospital, Tokyo	tokyo|medical|dental|university|hospital|tokyo	tokyo|medical|dental|university|dental|hospital|tokyo	1.0	False
355	60283921	Japan	Tokyo	60284770	Japan	Tokyo	Tokyo Medical and Dental University Hospital, Tokyo	Tokyo Medical and Dental University Medical Hospital, Tokyo	tokyo|medical|dental|university|hospital|tokyo	tokyo|medical|dental|university|medical|hospital|tokyo	1.0	False
356	60295047	United States	Sturgis	60299119	United States	Sturgis	Maggie's Pearl LLC, Sturgis	Maggie's Pearl, LLC, Sturgis	maggie|s|pearl|llc|sturgis	maggie|s|pearl|llc|sturgis	1.0	False
357	60299119	United States	Sturgis	60295047	United States	Sturgis	Maggie's Pearl, LLC, Sturgis	Maggie's Pearl LLC, Sturgis	maggie|s|pearl|llc|sturgis	maggie|s|pearl|llc|sturgis	1.0	False
358	60298785	United States	Irvine	60298786	United States	Irvine	Tensor Biosciences Inc., Irvine	Tensor Biosciences, Inc., Irvine	tensor|biosciences|irvine	tensor|biosciences|irvine	1.0	False
359	60298786	United States	Irvine	60298785	United States	Irvine	Tensor Biosciences, Inc., Irvine	Tensor Biosciences Inc., Irvine	tensor|biosciences|irvine	tensor|biosciences|irvine	1.0	False
360	60317570	United States	Round Rock	60318193	United States	Round Rock	Monolith Semiconductor Inc., Round Rock	Monolith Semiconductor, Round Rock	monolith|semiconductor|round|rock	monolith|semiconductor|round|rock	1.0	False
361	60323912	United States	Sunnyvale	60320594	United States	Sunnyvale	Network Appliance, Inc., Sunnyvale	Network Appliance, inc., Sunnyvale	network|appliance|sunnyvale	network|appliance|sunnyvale	1.0	False
